{
  "$schema":"https://json-schema.org/draft/2020-12/schema","$id":"https://commandf.dev/schemas/af02-required-check-policy-v1.schema.json","title":"commandf.af02-required-check-policy/v1","type":"object","additionalProperties":false,
  "required":["schema","repository","app","event","checks"],
  "properties":{"schema":{"const":"commandf.af02-required-check-policy/v1"},"repository":{"const":"TheHalfMoon/commandF"},"app":{"type":"object","additionalProperties":false,"required":["id","slug","owner"],"properties":{"id":{"const":15368},"slug":{"const":"github-actions"},"owner":{"const":"github"}}},"event":{"const":"pull_request"},"checks":{"type":"array","minItems":3,"maxItems":3,"prefixItems":[{"$ref":"#/$defs/assurance"},{"$ref":"#/$defs/rust"},{"$ref":"#/$defs/scorecard"}],"items":false}},
  "$defs":{"gitSha":{"type":"string","pattern":"^[0-9a-f]{40}$"},"base":{"type":"object","additionalProperties":false,"required":["context","workflow_id","workflow_path","workflow_blob_sha","job_name"],"properties":{"context":{"type":"string"},"workflow_id":{"type":"integer","minimum":1},"workflow_path":{"type":"string","pattern":"^\\.github/workflows/[A-Za-z0-9._-]+\\.ya?ml$"},"workflow_blob_sha":{"$ref":"#/$defs/gitSha"},"job_name":{"type":"string","minLength":1}}},"assurance":{"allOf":[{"$ref":"#/$defs/base"},{"properties":{"context":{"const":"assurance-proof"},"workflow_id":{"const":343599979},"workflow_path":{"const":".github/workflows/af01-assurance-proof.yml"},"workflow_blob_sha":{"const":"f41045416803fac9ed22aeacf0e38c0fc2a6289f"},"job_name":{"const":"assurance-proof"}}}]},"rust":{"allOf":[{"$ref":"#/$defs/base"},{"properties":{"context":{"const":"rust"},"workflow_id":{"const":333259855},"workflow_path":{"const":".github/workflows/ci.yml"},"workflow_blob_sha":{"const":"41f33c1aa0f458363cc92bbc206df4fe203b32ef"},"job_name":{"const":"rust"}}}]},"scorecard":{"allOf":[{"$ref":"#/$defs/base"},{"properties":{"context":{"const":"scorecard"},"workflow_id":{"const":343592713},"workflow_path":{"const":".github/workflows/af01-scorecard.yml"},"workflow_blob_sha":{"const":"69aa7d808d7b13b3a7cac21a71a09b55c432794b"},"job_name":{"const":"scorecard"}}}]}}
}
